,chords,view,star,date,url,text
Корсар,"['Am', 'G', 'Dm', 'F', 'C', 'B', 'E', 'D', 'A', 'B5', 'A5', 'C5', 'D5']",13074,30,19.02.2015,https://amdm.ru/akkordi/knyazz/107710/korsar/,"['На британские законы', 'Предпочел он наплевать,', 'Как на суше, так и в море,', 'Было с кем повоевать', 'С авантюрными делами', 'Он судьбу свою связал,', 'За сотню миль', 'Наживу чувствовал корсар', 'К черту за пазуху он направлял паруса,', 'В погоне за удачей,', 'К тем островам, где звучали сирен голоса,', 'И ветер жил бродячий', 'А-а-а-а-а', 'В погоне за удачей', 'Проигрыш:', '}x2', 'Нет, не думал он о чести,', 'В спину бил своих врагов,', 'Приручил коварных бестий', 'Что топили моряков', 'Он купеческие судны', 'В лоно смерти завлекал,', 'В богатстве разум', 'Безнадежно утопал', 'К черту за пазуху он направлял паруса,', 'В погоне за удачей,', 'К тем островам, где звучали сирен голоса,', 'И ветер жил бродячий', 'А-а-а-а-а', 'В погоне за удачей', 'Проигрыш:', '}x2', 'Девы морскими, ведомые силами зла,', 'Они отнюдь не постоянны', 'Вся эта сделка для бестий всего лишь игра,', 'Не зря их души так коварны', 'Чтож ты, бывалый моряк, этот факт не учел?', 'Твой флаг болтается на рее', 'Сам же в пучине свою ты погибель обрел', 'И стал любимым их трофеем', 'А-а-а-а-а', 'И стал любимым их трофеем', 'А-а-а-а-а', 'И стал любимым их трофеем']"
Крот,"['A', 'Hm', 'F#m', 'G', 'D5', 'Em', 'F#5']",1060,2,04.11.2021,https://amdm.ru/akkordi/knyazz/186942/krot/,"['Стынет дома обед,', 'Бабушка ждёт её вновь,', 'Девчонки третий день дома нет,', 'Она снова где-то ищет любовь.', 'В грязном прокуренном баре,', 'Среди одиноких мужчин,', 'Играла она на гитаре', 'И пила из баночек джин.', 'А после она танцевала', 'Со всеми, кто к ней подходил.', 'Так громко она хохотала,', 'Насколько хватало ей сил.', 'Но вот подошел к ней мужчина,', 'Своим не хозяин ногам.', 'Хотел он совсем беспричинно', 'Кому-нибудь дать по рогам.', 'Не поздравит с днём рождения,', 'Грубы его движения,', 'Нет ни грамма уважения.', 'Крот, крот, крот, крот.', 'Самый первый среди пьяниц,', 'Жлоб он и оборванец,', 'Алкоголик — тунеядец.', 'Крот, крот, крот, крот.', '(Его называли мерзавцем, - ой не туда начал!)', 'Его называли мерзавцем,', 'Он в баре скрывался как крот.', 'Себя же считал красавцем,', 'Хотя был реально урод.', 'Она его вдруг захотела,', 'Он был не обычней других.', 'Его худощавому телу', 'Она посвятила свой стих.', 'Не поздравит с днём рождения,', 'Грубы его движения,', 'Нет ни грамма уважения.', 'Крот, крот, крот, крот.', 'Самый первый среди пьяниц,', 'Жлоб он и оборванец,', 'Алкоголик — тунеядец.', 'Крот, крот, крот, крот.', 'Она с наступлением ночи', 'В постель с негодяем легла.', 'Ей всё не понравилось очень,', 'Но так повзрослела она.', 'Не поздравит с днём рождения,', 'Грубы его движения,', 'Нет ни грамма уважения.', 'Крот, крот, крот, крот.', 'Самый первый среди пьяниц,', 'Жлоб он и оборванец,', 'Алкоголик — тунеядец.', 'Крот, крот, крот, крот.', 'Алкоголик — тунеядец.', 'Крот, крот, крот, крот.', 'Алкоголик — тунеядец.', 'Крот, крот, крот, крот.', 'Алкоголик — тунеядец.']"
Кукловод,"['Bm', 'G', 'A', 'E', 'F#', 'Em']",15130,31,06.11.2015,https://amdm.ru/akkordi/knyazz/127245/kuklovod/,"['Intro:', '}x4', 'Сколько мы лет не общались, хоть каждый день были рядом?', 'Ночи в кошмар превращались, я свою жизнь сделал адом!', 'В тайном в моём ритуале - я совершил оживление,', 'Но от людей скрыл в подвале своё ужасное творенье.', 'Припев:', 'Все зря, - надежды безумца сжигало пламя огня;', 'И чем труды обернуться - никто не предостерёг меня!', 'Память ушла безвозвратно, с этим не мог я смириться -', 'И каждый день пил изрядно; Как право, тут, не напиться?', 'Тело её танцевало в сумраке так неуклюже.', 'С годами лучше не стало. Стало, клянусь, только хуже!', 'Припев:', 'Все зря, - надежды безумца сжигало пламя огня;', 'И чем труды обернуться - никто не предостерёг меня!', '}x3', 'Гибла любовь с каждым годом. Дразнили ради забавы.', 'Бесы меня - кукловода; и, чёрт возьми - были правы!', 'Я - с ней бедой обрученный, такой судьбы поворот.', 'В прошлым - гениальный учёный, а ныне, я - кукловод!', 'Я - с ней бедой обрученный, такой судьбы поворот.', 'В прошлым - гениальный учёный, а ныне, я - кукловод!', 'Ныне, я - кукловод!', 'Ныне, я - кукловод!', 'Ныне, я - кукловод!', 'Outro:', '}x3']"
Мастер кукол,"['Em', 'Bm', 'G', 'F#', 'F#m', 'A', 'D']",6691,14,06.03.2015,https://amdm.ru/akkordi/knyazz/108865/master_kukol/,"['Мастера кукол больше нет,', 'Но продолжают жить его создания.', 'В землю унёс он свой секрет:', 'Как им энергию дать и сознание.', 'Разум бедняги впал во мрак,', 'Куклы впитали пороки создателя:', 'Всю его злость и весь его страх,', 'И над театром нависло проклятие!', 'Хэй! Спешите скорей!', 'Театр откроет дверь', 'Перед всеми, кому близок кукольный мир.', 'Злобно смотрит в зал стеклянный глаз...', 'Шоу демонических гримас...', 'Эй, незадачливый зритель, а ну-ка держись!', 'Порции ужасов хватит на всю твою жизнь!', 'Сцена убийства кукол даёт', 'Пищу собравшимся для размышления:', 'Кто этот чокнутый кукловод,', 'В чьей голове одни лишь извращения?', 'Но кукловода вовсе нет,', 'Куклы создали всё это безумие.', 'Жуткий они ставят сюжет:', 'Зло оживает в часы полнолуния.', 'Хэй! Спешите скорей!', 'Театр откроет дверь', 'Перед всеми, кому близок кукольный мир.', 'Злобно смотрит в зал стеклянный глаз...', 'Шоу демонических гримас...', 'Нынче твердят без конца заголовки газет:', 'Кто-то из дома ушёл и простыл его след.', 'Если вам кукла вручает в театр билет,', 'Лучше подумать: идти вам туда или нет!', 'Эй, незадачливый зритель, а ну-ка держись!', 'Порции ужасов хватит на всю твою жизнь!', 'Только в конце предстваления, наверняка,', 'Может и жизнь неожиданно стать коротка!', 'Вход, как обычно,', 'Будет бесплатным!', 'Шоу отличным,', 'До ужаса приятным!', 'Мастера кукол больше нет...']"
Меригуан,"['Em', 'Am', 'C', 'G', 'F']",3978,3,25.03.2016,https://amdm.ru/akkordi/knyazz/137373/meriguan/,"['А мой старый добрый друг, Меригуан', 'Был как всегда весел и пьян,', 'Сидел и с мухами играл,', 'Песню запел - слова переврал.', 'Достал он карты, разложил колоду', 'И нагадал хорошую погоду,', 'А также дальнюю себе дорогу', 'И беспризорного кота в подмогу.', 'От удивленья он упал со стула,', 'Спугнул старуху, что вблизи уснула', 'Меригуан, Меригуан...   2 раза', 'В уютном кабаке сидела вдова,', 'Мой друг о любви шептал ей слова,', 'Придумал тост, красиво встал,', 'Налил, опрокинул, в рот не попал.', 'В простой семье на свет он появился,', 'В округе весь народ ему дивился,', 'Хотел он есть ни суп, ни даже кашку,', 'А туже косточку, что грыз папашка,', 'Какое имя дать ему не знали,', 'Но вдруг из уст младенца услыхали:', 'Меригуан, Меригуан...   2 раза', 'Под водку куропатку он заказал,', 'Только ее он кушать не стал,', 'Пошел во двор, взял, закурил,', 'Выкопал ямку, похоронил.', 'Ведь доброта его границ не знает,', 'Ко всем он состраданье проявляет,', 'С улыбкой доброй ходит он по свету,', 'И у него врагов по жизни нету.', 'Он человек, да только под вопросом,', 'Поскольку батьку его звать Барбосом.', 'Меригуан, Меригуан...   2 раза']"
Мистер Шок,"['F#5', 'B5', 'E5', 'E', 'F#m', 'Bm', 'C#m']",6254,6,01.06.2015,https://amdm.ru/akkordi/knyazz/115427/mister_shok/,"['Intro:', '|', '}4p', '|', 'Как известно, чему быть,', 'Того не миновать.', 'Его имя, вероятно,', 'Вам не стоит знать.', 'Помнит он, что день грядущий', 'Не в его руках,', 'Оттого панически', 'Боится слова «крах».', 'Зритель, ты ответь,', 'Деньги или смерть?', 'Он уверен, если', 'Уникальный в тебе дар,', 'Продавай себя, покуда', 'Ты ещё не стар.', 'Откликаясь на желания', 'Кровожадных лиц,', 'Каждый день доходит', 'До запретных он границ.', 'Дамы, господа', 'Платят, как всегда.', 'Нет, не даст вам уснуть', 'Величайший игрок', 'Смерть свою обмануть', 'Сможет Мистер Шок.', 'Возвращался не раз', 'Он из небытия.', 'Обретёт звёздный час,', 'Выстрелив в себя.', 'Подходите ближе!', 'Так судьба бесстыжа,', 'Заставляет делать', 'Это его вновь', 'В закутках Парижа', 'Не ради престижа,', 'Ради звона денег', 'Проливает кровь.', 'Проигрыш:', '|', '}2p', 'Как известно, Мистер Шок –', 'Богач, миллионер.', 'Новые камзолы', 'Закупает костюмер.', 'Если сыпать деньги', 'Возле уха мертвеца,', 'То становится нормальным', 'Цвет его лица.', 'Уже много лет', 'Сна учёным нет.', 'Нет, не даст вам уснуть', 'Величайший игрок', 'Смерть свою обмануть', 'Сможет Мистер Шок.', 'Возвращался не раз', 'Он из небытия.', 'Обретёт звёздный час,', 'Выстрелив в себя.', 'Подходите ближе!', 'Так судьба бесстыжа,', 'Заставляет делать', 'Это его вновь', 'В закутках Парижа', 'Не ради престижа,', 'Ради звона денег', 'Проливает кровь.', 'Проигрыш:', '|', '}6p', 'Нет, не даст вам уснуть', 'Величайший игрок', 'Смерть свою обмануть', 'Сможет Мистер Шок.', 'Возвращался не раз', 'Он из небытия.', 'Обретёт звёздный час,', 'Выстрелив в себя.', 'Нет, не даст вам уснуть', 'Величайший игрок', 'Смерть свою обмануть', 'Сможет Мистер Шок.', 'Возвращался не раз', 'Он из небытия.', 'Обретёт звёздный час,', 'Выстрелив в себя.', 'Подходите ближе!', 'Так судьба бесстыжа,', 'Заставляет делать', 'Это его вновь', 'В закутках Парижа', 'Не ради престижа,', 'Ради звона денег', 'Проливает кровь.']"
Мозгоправ,"['E5', 'D5', 'C5', 'Em', 'Am', 'Hm', 'A']",856,1,04.11.2021,https://amdm.ru/akkordi/knyazz/186938/mozgoprav/,"['x2', 'x4', 'Я к предрассудкам глух и нем,', 'Владыка мира внутренних проблем.', 'Я в голове сижу у вас,', 'Надеюсь, живы те, кого я спас.', 'Людям помогаю,', 'Но сам хожу по краю,', 'Приближаю', 'Неистовый финал.', 'Где точка невозврата', 'Я сам, увы, не знаю,', 'Ведь с годами', 'Всех безумнее я стал.', 'Всех безумнее я стал.', 'Мозгоправ!     x4', 'А кто от паранойи сам не свой,', 'Ему полезно встретиться со мной,', 'Он старым бзикам будет рад,', 'Когда я покажу реальный Ад!', 'Людям помогаю,', 'Но сам хожу по краю,', 'И пустая,', 'К чёрту, болтовня.', 'Взгляд на вещи', 'Резко поменяю,', 'Станет Раем', 'Всё, что было до меня.', 'Всё, что было до меня.', '(', ')   x2', 'Ваш недуг — моя забава,', 'Бойтесь стресса, как огня!', 'Никому не дам я права', 'Быть безумнее  меня.', 'Ваш недуг — моя забава,', 'Бойтесь стресса, как огня!', 'Мкхг!', 'А в чём дело? скажите пожалуйста куда уходит музыка.', 'Кто ответит на мой вопрос?', 'Куда уходит музыка..']"
Мушкетёры,"['Bm', 'Em', 'G', 'F#', 'A6', 'A', 'D', 'G/A']",10238,18,30.12.2014,https://amdm.ru/akkordi/knyazz/102935/mushketyori/,"['Вступление: :2/4:', '|', '|', '|', '}x2', 'Что, братцы, за война,', 'Если не пить вина,', 'А с вином – всё путём.', 'Без женского тепла', 'Скучной бы жизнь была,', 'Эх, давай, друг, споём.', 'Кубки вверх!', 'Выпьем за успех!', 'Припев:', 'Говорят, у мушкетёров только', 'На уме вино и женский пол.', 'Но для чего тогда в казарме койка,', 'А в трактире деревянный стол?', 'Отвагой сердца полны,', 'Мы королю верны,', 'Хоть трезвы, да хоть пьяны.', 'В трусости нас зато', 'Не упрекнёт никто.', 'В шпаги мы влюблены.', 'Деньги – прах!', 'К чёрту страх!', 'Припев:', 'Говорят, у мушкетёров только', 'На уме вино и женский пол.', 'Но для чего тогда в казарме койка,', 'А в трактире деревянный стол?', 'И в бою, господа,', 'Страх для нас – сущий вздор.', 'Пей до дна! Пей до дна!', 'Пей до дна, мушкетёр!', 'Синий плащ, герой,', 'Правильный выбор твой.', 'Король и Франция с тобой!', 'Хой!', 'Проигрыш:', '|', '|', '|', '}x2', '|', '|', '|', '}x2', 'Припев:', 'Говорят, у мушкетёров только', 'На уме вино и женский пол.', 'Но для чего тогда в казарме койка,', 'А в трактире деревянный стол?', 'И в бою, господа,', 'Страх для нас – сущий вздор.', 'Пей до дна! Пей до дна!', 'Пей до дна, мушкетёр!', 'Каналья!']"
Наука Билли Бонса,"['Dm', 'Gm', 'A#', 'A', 'F', 'C', 'Em', 'Am', 'B']",24970,57,05.12.2017,https://amdm.ru/akkordi/knyazz/161944/nauka_billi_bonsa/,"['– Тысяча чертей!', '– Разрази меня гром!', '– Якорь тебе в глотку!', '– Жена твоя – каракатица!', '– Чтоб тебе подавиться ядовитой медузой!', '– Да чтобы проклятый осьминог выпил весь ром в твоём желудке!', '}x2', 'Я к ней летел, как мотылёк на свет.', 'Всё было бы прекрасно, но, увы, –', 'Навязанный судьбой авторитет', 'Не вылезал из головы.', 'С бутылкой рома пьяный предок мой,', 'Как в детстве, возникал передо мной.', 'И говорил мне старый Билли Бонс –', 'Слова звучали грозно и всерьёз:', '«Не смей влюбляться, угодишь впросак!»', 'И в стену ржавый свой швырял тесак.', '}x2', 'Как мог старик залезть в мои мозги?', 'С ума сводила скверная игра.', 'Когда мы становились с ней близки,', 'Не те я говорил слова,', 'Вместо комплимента – брань и мат.', 'Девица в слёзы, дед мой рад.', 'И говорил мне старый Билли Бонс –', 'Слова звучали грозно и всерьёз:', '«Не смей влюбляться, угодишь впросак!»', 'И в стену ржавый свой швырял тесак.', 'Десять лет назад', 'В кабачной драке был убит пират.', 'Кто же тебя в ад', 'Отправил? Билли Бонс, ответь,', 'Старый гад.', '(+1 тон)', 'Лишь стоит за порог мне сделать шаг,', 'Как ноги сами топают в кабак.', 'И люди шепчут за моей спиной,', 'Что я один в один, как предок мой.', 'Мне нет покоя, сам тому не рад,', 'Что начинаю думать, как пират.', 'Прогнать дурные мысли нелегко!', 'И снова тянет крикнуть: «Йо-хо-хо!»']"
Норманны,"['Gm', 'F', 'Cm', 'D5', 'C#m', 'D#5', 'Fm', 'C5', 'B']",2257,5,27.01.2021,https://amdm.ru/akkordi/knyazz/180181/normanny/,"['[Вступление]:', '/', '4:---5-6-5--3-5-5----5-6-5--3-5-5-|', '5:--------------------------------|', '6:--3-------------3-3-------------|    x4', '[Куплет 1]:', 'Причалим ли мы к чужим берегам,', 'Иль сгинем в пучине на радость врагам, -', 'Валькирии о подвигах наших', '/', '/', 'Расскажут великим богам!', '/', '4:---5-6-5--3-5-5----5-6-5--3-5-5-|', '5:--------------------------------|', '6:--3-------------3-3-------------|    x2', '[Куплет 2]:', 'Ни Локи, ни змей из бездны морской', 'Не в силах сломить наш дух боевой', 'Здесь нету сопливых мальчишек,', '/', '/', 'Здесь каждый - отважный герой.', '[Припев]:', 'Путь до той звезды, что светит в небе ярче остальных,', 'Смертью нам грозит, но дело того стоит!', 'Один - бог войны - услышит в небе звон клинков стальных.', 'Буря, лютый шторм нас только раззадорят!', 'Ху-Ху-Ху-Ху-Ху-Ху-Ху-Ху-Ху-Ху-Норманы!', 'Ху-Ху-Ху-Ху-Ху-Ху-Ху-Ху-Ху-Ху-Норманы!', '/', '4:---5-6-5--3-5-5----5-6-5--3-5-5-|', '5:--------------------------------|', '6:--3-------------3-3-------------|    x2', '[Куплет 3]:', 'Нас Ярл собрал, оружие дал', 'И пир обещал, какого свет не видал,', 'Когда с добычей вернёмся,', '/', '/', 'И кормчий оставит штурвал.', '[Припев]:', 'Путь до той звезды, что светит в небе ярче остальных,', 'Смертью нам грозит, но дело того стоит!', 'Один - бог войны - услышит в небе звон клинков стальных.', 'Буря, лютый шторм нас только раззадорят!', 'Ху-Ху-Ху-Ху-Ху-Ху-Ху-Ху-Ху-Ху-Норманы!', 'Ху-Ху-Ху-Ху-Ху-Ху-Ху-Ху-Ху-Ху-Норманы!', '[Соло]:', '6:--3--3-3-6-6-8-8-8--8-6-8-6-3-3-3-5-5-5-2-2-|', 'Ху!        Ху!          Ху!              х4', '/', '/', 'x2', '[Припев]:', 'ХА! Путь до той звезды, что светит в небе ярче остальных,', 'Смертью нам грозит, но дело того стоит!', 'Один - бог войны - услышит в небе звон клинков стальных.', 'Буря, лютый шторм нас только раззадорят!', '[Кода]:', 'Ху-Ху-Ху-Ху-Ху-Ху-Ху-Ху-Ху-Ху-Норманы!', 'Ху-Ху-Ху-Ху-Ху-Ху-Ху-Ху-Ху-Ху-Норманы!']"
Один как тень,"['A#', 'Cm', 'D#', 'F', 'Gm', 'D7']",4068,2,28.06.2016,https://amdm.ru/akkordi/knyazz/144009/odin_kak_ten/,"['Вступление:', 'С петлёй на шее', 'Вдруг он очнулся во мгле,', 'И карты вокруг', 'На залитом ромом ковре.', 'Из пиджака записку вытащил он', 'Свой почерк не без труда смог прочесть,', 'Я свою жизнь сегодня ставлю на кон,', 'Она последнее, что у меня есть!', 'Припев:', 'Вновь один, как тень,', 'Один, как тень,', 'Среди камней надгробных,', 'Он четвёртый день,', 'Четвёртый день,', 'Искал себе подобных.', 'Смотрел, на диск он', 'И столь нелепый итог,', 'Своей дрянной судьбы,', 'Он представить не мог.', 'Ангелам явно наплевать на него,', 'Но он и чёрта повстречать был бы рад.', 'Что же за смерть, такая нет ничего,', 'Ни света божьего, ни адских врат!', 'Припев:', 'Вновь один, как тень,', 'Один, как тень,', 'Среди камней надгробных,', 'Он четвёртый день,', 'Четвёртый день,', 'Искал себе подобных.']"
